id,input_url,user_name,score,published_at,text
1,"https://www.google.com/maps/place/La+Tour+d'Argent/@48.8497901,2.3527581,17z/data=!3m1!4b1!4m5!3m4!1s0x47e671e4b41c8a83:0x5bd4a63441a1398a!8m2!3d48.8498104!4d2.3548718?authuser=0&hl=en",mimi Davis,5,7 months ago,"My first visit to La Tour d’Argent on New Year’s Eve. We made the choice to leave the year 2021 behind, to start 2022 for the better new year.  We arrived at 8 pm. On the ground floor, they were many staff welcoming us to the restaurant which I think La Tour d’Argent isn’t just a restaurant but they pack with all the legendary clients photos and clients signature cards collection on the wall heading to the elevator , I am feeling, I was walking into a place full with the legendary guests on the wall. I am feeling so special to be able to come so far from home to Paris.
We took the elevator up to the restaurant area with a live singer and band playing music all night, very festive! We have the set menu for new year and i am glad to have this: every dish is so so fresh and delicious. Let me tell you about the service, the staff are very friendly, they know not to interrupt you during all the night and also made everything so smooth, I am feeling comfortable and enjoy food although conversation like sitting at my own home."
2,"https://www.google.com/maps/place/La+Tour+d'Argent/@48.8497901,2.3527581,17z/data=!3m1!4b1!4m5!3m4!1s0x47e671e4b41c8a83:0x5bd4a63441a1398a!8m2!3d48.8498104!4d2.3548718?authuser=0&hl=en",Luke Camery,5,3 months ago,"Once in a lifetime experience so it's difficult to rank appropriately. Obviously the aesthetics and service were unbelievable. Definitely feels like a three Michelin star white glove experience.

The duck courses were fantastic and highly unusual which was a rare plus. The wine list is larger than an encyclopedia and is thrilling. All wines are at least 100 euros but given that, honestly, the selection of 20+ year old wine under 200 euros is impressive.

The cheese cart and desserts are both can't miss items. Not for every visit to Paris but at least once in a lifetime!"
3,"https://www.google.com/maps/place/La+Tour+d'Argent/@48.8497901,2.3527581,17z/data=!3m1!4b1!4m5!3m4!1s0x47e671e4b41c8a83:0x5bd4a63441a1398a!8m2!3d48.8498104!4d2.3548718?authuser=0&hl=en",Marija Brajković,5,5 months ago,A beautiful restaurant with an extremely long tradition.  extremely creative cuisine.  rich wine cellar.  Wonderful staff.  A divine view of Notre Dame. At the end of lunch they give you a gift souvenir  of a glass goose.
4,"https://www.google.com/maps/place/La+Tour+d'Argent/@48.8497901,2.3527581,17z/data=!3m1!4b1!4m5!3m4!1s0x47e671e4b41c8a83:0x5bd4a63441a1398a!8m2!3d48.8498104!4d2.3548718?authuser=0&hl=en",Aaron,5,4 months ago,Best meal I had in Paris. Everything was perfection. The wait staff were exceptional. Got a small glimpse of the kitchen because the normal lift for the restaurant was broken. That was neat. It felt like we were being let in a secret VIP entrance. A night I will remember.
5,"https://www.google.com/maps/place/La+Tour+d'Argent/@48.8497901,2.3527581,17z/data=!3m1!4b1!4m5!3m4!1s0x47e671e4b41c8a83:0x5bd4a63441a1398a!8m2!3d48.8498104!4d2.3548718?authuser=0&hl=en",MB,4,10 months ago,"Overall, a great experience. The duck was exquisite. History of this place is mind-blowing & we had a beautiful view of the River Seine.
We had the tasting menu. They failed to ask about any food allergies however which is surprising considering the calibre of the restaurant. Even the most basic restaurants always ask this question.
I let the server know of my shell fish allergy & they did accommodate for us eventually, however, not without causing a minor raucous.
Also caused a minor raucous that we did not drink alcohol & declined the champagne.
The restaurant could improve with acknowledging & being prepared people's different food & lifestyle preferences, otherwise a great experience."
6,"https://www.google.com/maps/place/La+Tour+d'Argent/@48.8497901,2.3527581,17z/data=!3m1!4b1!4m5!3m4!1s0x47e671e4b41c8a83:0x5bd4a63441a1398a!8m2!3d48.8498104!4d2.3548718?authuser=0&hl=en",MichelinStarsChallenge R,5,10 months ago,"#40 follow my Michelin Stars Marathon reviews on Googlemaps list
On top of the world!

If you’re French, sitting in la Tour d Argent, you’re feeling like you’re on top of the world… and you are since you have a magnificent view over, what we French consider as the world: Paris and Notre Dame.
I know what you’re going to say: it’s expensive. You’re right. It is. Is it really though ? The lunch menu is less than a very average 3 stars hotel in the city center. Which memories will last a lifetime? A meal at La Tour or an hotel night in a very average place?
I had the good fortune of speaking with the manager of the group (they also have a bakery -aka “oh my god those croissants are so good”, and an epicerie ). Interestingly, the difference with the others famous star Michelin in Paris, is that the proportion of none Parisian French customers is uniquely higher, allowing them to reopen way before the other big names. It does make sense. I wouldn’t live in Paris, why wouldn’t I eat in a place where I enjoy Paris, a great cuisine and an impeccable service?
Still, for the French, we save this restaurant for the “grandes occasions”, exceptional events like engagement, diplomas, etc… well, I’m living 2 mn walk from the place, I feel like I need to more exceptional event in my life…
So when I went, the restaurant patrons were mainly French, which is really different from other place I went (see my review on Septime). To make it short, if you want to be amongst wealthy French, now you know the address.
Which brings me to another point: the dressing code/mood. You ll receive an email after you booked reminding you that you should dress properly. Well, I think it’s important because I think there are places, where it’s great when all the patrons are well dressed. Being well dressed, it’s not only important for your experience, but also for the others, as you’re participating in creating an unique memory. I would feel as I m not respecting the other patrons (especially the couples) moment by not dressing up. I saw some French guy in chic, yet slightly casual, I was about to call the fashion police on them!
One last thing, don’t worry about it being to « formal « , the waiters will know how to put you at ease. It’s the quality of all the good Michelin Stars waiters, nice enough to be at ease, distant enough to feel respected. Here you have la crème de la crème.
But what about the food, I hear you wondering. It’s true that the setting, the history and the service will first occupy your mind. But then, you wonder if the cuisine will be up to the same level. The task is incredibly difficult. You went to be classical, yet haute cuisine, with some innovations (but not too much). The chef, who is a “meilleur ouvrier de France “ (like “top chef”, but before, without cameras and really focus on the cuisine…) manages to avoid the traps, and delivers beautifully. He manages to get out alive of this culinary “mine field “. Look at my pictures. It’s as good as it looks. It’s perfectly executed, coherent, balanced and perfectly in line with the rest of the experience. Which is another fit in itself.

It’s a very well deserved star, a top tiers one star.
It’ll create memories, that’ll you speak about years later. And I need to find a good reason to go back!"
7,"https://www.google.com/maps/place/La+Tour+d'Argent/@48.8497901,2.3527581,17z/data=!3m1!4b1!4m5!3m4!1s0x47e671e4b41c8a83:0x5bd4a63441a1398a!8m2!3d48.8498104!4d2.3548718?authuser=0&hl=en",Lyubov L,5,10 months ago,"La perfection 👌🏻
This is perfection ! The only possible comment on this experience !
It was my dream to enjoy a meal at this epic place, institution I would say.
And dreams come true.
Amazing experience. Over the top. The service, the view, the food ! 5*!"
8,"https://www.google.com/maps/place/La+Tour+d'Argent/@48.8497901,2.3527581,17z/data=!3m1!4b1!4m5!3m4!1s0x47e671e4b41c8a83:0x5bd4a63441a1398a!8m2!3d48.8498104!4d2.3548718?authuser=0&hl=en",Guy Campo,5,9 months ago,"The La Tour d'Argent is the oldest restaurant in Paris (1582). Impecable and courteous service from the front door to the table. The chef offers a culinary experience. The Gran Livre de Vin is in the true sense of the word ""grand"". The restaurant over looks the Seine with Notre Dame in the distance. Our time there was very enjoyable and  memorable. If I were to something different, I would make a reservation just sunset."
9,"https://www.google.com/maps/place/La+Tour+d'Argent/@48.8497901,2.3527581,17z/data=!3m1!4b1!4m5!3m4!1s0x47e671e4b41c8a83:0x5bd4a63441a1398a!8m2!3d48.8498104!4d2.3548718?authuser=0&hl=en",Ronaldo Baumgarten Neto,5,5 months ago,Had a wonderful experience! No doubt it’s become my favorite restaurant in Paris! Best duck ever 🦆
10,"https://www.google.com/maps/place/La+Tour+d'Argent/@48.8497901,2.3527581,17z/data=!3m1!4b1!4m5!3m4!1s0x47e671e4b41c8a83:0x5bd4a63441a1398a!8m2!3d48.8498104!4d2.3548718?authuser=0&hl=en",Charles Dorin,5,3 months ago,"Great Côte de bœuf paired with Graves Wine. Staff was lovely, and we had a good time. Will be back without hesitation."
11,"https://www.google.com/maps/place/La+Tour+d'Argent/@48.8497901,2.3527581,17z/data=!3m1!4b1!4m5!3m4!1s0x47e671e4b41c8a83:0x5bd4a63441a1398a!8m2!3d48.8498104!4d2.3548718?authuser=0&hl=en",Sandrine Boniface,2,2 months ago,"I’m sure the Tour d’argent is great but the Rotisserie needs improvement. Such simple cuisine is only good when the people who prepare are super careful and know what they are doing. They employ too many apprentices who treat the job like MacDo. Please, that’s not fair to us diners. We all can roast a chicken at home. We expect La Tour staff to cook each one to perfection, otherwise what’s the point? Food was OK, our waiter great, other staff were not fit for such a restaurant and should not only focus on their job but also not stare at guests!"
12,"https://www.google.com/maps/place/La+Tour+d'Argent/@48.8497901,2.3527581,17z/data=!3m1!4b1!4m5!3m4!1s0x47e671e4b41c8a83:0x5bd4a63441a1398a!8m2!3d48.8498104!4d2.3548718?authuser=0&hl=en",John Kamauff,5,4 months ago,"La Tour d'Argent remains one of the best restaurants in the world; the location and view (especially on a beautiful Parisian Spring day like we had) are unparalleled.  The food and presentation were amazing, and the wine (under Antoine's expert tutelage) was exceptional. We cannot wait for our next visit."
13,"https://www.google.com/maps/place/La+Tour+d'Argent/@48.8497901,2.3527581,17z/data=!3m1!4b1!4m5!3m4!1s0x47e671e4b41c8a83:0x5bd4a63441a1398a!8m2!3d48.8498104!4d2.3548718?authuser=0&hl=en",Donna D,5,3 months ago,"An excellent way to spend a lunchtime. The views are magnificent, the wine list extraordinary, the food delicious, and the service perfectly unobtrusive. Thank you very much to the chef and the teams."
14,"https://www.google.com/maps/place/La+Tour+d'Argent/@48.8497901,2.3527581,17z/data=!3m1!4b1!4m5!3m4!1s0x47e671e4b41c8a83:0x5bd4a63441a1398a!8m2!3d48.8498104!4d2.3548718?authuser=0&hl=en",Boris Shmukler,4,3 months ago,Solid traditional food and a great location.
15,"https://www.google.com/maps/place/La+Tour+d'Argent/@48.8497901,2.3527581,17z/data=!3m1!4b1!4m5!3m4!1s0x47e671e4b41c8a83:0x5bd4a63441a1398a!8m2!3d48.8498104!4d2.3548718?authuser=0&hl=en",J Alsaud,5,4 months ago,"Delicious food, friendly staff, great experience,"
16,"https://www.google.com/maps/place/La+Tour+d'Argent/@48.8497901,2.3527581,17z/data=!3m1!4b1!4m5!3m4!1s0x47e671e4b41c8a83:0x5bd4a63441a1398a!8m2!3d48.8498104!4d2.3548718?authuser=0&hl=en",laura castro,1,2 months ago,"Terrible experience at the Rotisserie today
22/05 , I was so very much looking forward to finishing my trip in this restaurant which used to be fantastic and ended up having a terrible experience yet super expensive for what it was. I was looking forward to order a foie grass and a duck confit but I understood that there is an issue due to the duck fever, I ended up ordering the overpriced roasted chicken which  was served totally cold, I had to send it back and the waiter did not even apologise, he returned with the same piece of chicken reheated. It is extremely disappointing for the prices you are charging this should not be happening.

Not sure I will be visiting again"
17,"https://www.google.com/maps/place/La+Tour+d'Argent/@48.8497901,2.3527581,17z/data=!3m1!4b1!4m5!3m4!1s0x47e671e4b41c8a83:0x5bd4a63441a1398a!8m2!3d48.8498104!4d2.3548718?authuser=0&hl=en",P Luis,1,2 weeks ago,This place is completely racist and staff has no horeca skills whatsoever. My wife was not allowed to use toilet while we waited for a table next to the bridge. Waiter declined service since we were only to take some wine and snacks. Do not recommend
18,"https://www.google.com/maps/place/La+Tour+d'Argent/@48.8497901,2.3527581,17z/data=!3m1!4b1!4m5!3m4!1s0x47e671e4b41c8a83:0x5bd4a63441a1398a!8m2!3d48.8498104!4d2.3548718?authuser=0&hl=en",John Brainerd,4,2 months ago,"We were impressed with the quality of the food and service.  Our waiter had a wonderful sense of humor and made us feel very welcome.  We were seated by the window and had a good view of the Seine.  Before leaving, we were offered and enjoyed an aged Sauterne ""on the house"" because we were such a cute couple.  It was our last night in Paris so we left the city with a wonderful memory."
19,"https://www.google.com/maps/place/La+Tour+d'Argent/@48.8497901,2.3527581,17z/data=!3m1!4b1!4m5!3m4!1s0x47e671e4b41c8a83:0x5bd4a63441a1398a!8m2!3d48.8498104!4d2.3548718?authuser=0&hl=en",Jörg K,2,3 months ago,"Tour d'Argent advertises exceptional view and star cuisine. The view is great.

The food, we had the 6 course menu, is unfortunately not. The appetizers a slice of salmon, a scoop of duck foie gras with jelly, and caviar on cream cheese are boring without refined flavors. In the main course of fish with spinach, the fish was less convincing than the caramelized seafood. The meat dish a slice of duck stuffed with duck foie gras (again) came with a heavily salted sauce. The dessert was lemon soufflé served with lemon sorbet. The soufflé was well risen in the top third, unfortunately it still had a whole solid block of raw dough in the bottom two thirds.

The service seemed completely unimpressed with our still-filled plates when we returned them.

This restaurant is overall not very neat and clean. For example, dirty chairs with obvious food residue were conspicuous."
20,"https://www.google.com/maps/place/La+Tour+d'Argent/@48.8497901,2.3527581,17z/data=!3m1!4b1!4m5!3m4!1s0x47e671e4b41c8a83:0x5bd4a63441a1398a!8m2!3d48.8498104!4d2.3548718?authuser=0&hl=en",Karl de Borbón,5,11 months ago,"It was a dream for me as youngster to eat at this monument restaurant located in very authentic Parisienne area, actually it was a dream to many to be in the same restaurant where they ate in it almost all famous kings, presidents and leaders and personalities from around the planet since it was founded in 1582, yes you heard that right since 439 years ago and The location Quai de la Tournelle, where the restaurant stands, was not paved until the year 1650, before which it was ""a slope, often flooded and almost always made inaccessible by mud...... I booked 4 months in advance to our trip to Paris and paid a deposit to book the table and here I am with my date my lovely wife
We choose our table at the window facing the river and it couldn’t be more romantic than that view,
The food was exceptional and the wine list was amazing and I guess one of a kind in the planet since the thickness it was like 2 phone books attached together and the service was outstanding and professional and mostly the butler,,, Obviously
We enjoyed the whole evening the appetizers, the main course and the dessert and most of all the 1999 bottle of French wine,
After the dinner the manager showed us around where we look at the pictures of kings and presidents has been and ate at this same place (like us) :)"
21,"https://www.google.com/maps/place/La+Tour+d'Argent/@48.8497901,2.3527581,17z/data=!3m1!4b1!4m5!3m4!1s0x47e671e4b41c8a83:0x5bd4a63441a1398a!8m2!3d48.8498104!4d2.3548718?authuser=0&hl=en",Blake Elizabeth Sachs,5,a month ago,Wonderful service and the best chicken I've ever had. Cannot recommend enough.
22,"https://www.google.com/maps/place/La+Tour+d'Argent/@48.8497901,2.3527581,17z/data=!3m1!4b1!4m5!3m4!1s0x47e671e4b41c8a83:0x5bd4a63441a1398a!8m2!3d48.8498104!4d2.3548718?authuser=0&hl=en",Paul Lee,1,a month ago,"Very bad experience for me.
First of all, it was very hard to order our food and wine because nobody was looking at us for a long time. We ordered a bottle of wine but it was never delivered, so we had to change the order(and that was very difficult as well because nobody was paying attention to diners inside). Although we reserved more than a month ago, everybody was busy for terrace seats. At the end of the meal, my silverwares were clearly pointing I'm in the middle of eating but a person who seems to be the manager just took the dish not even asking I was finished or not."
23,"https://www.google.com/maps/place/La+Tour+d'Argent/@48.8497901,2.3527581,17z/data=!3m1!4b1!4m5!3m4!1s0x47e671e4b41c8a83:0x5bd4a63441a1398a!8m2!3d48.8498104!4d2.3548718?authuser=0&hl=en",Eamonn Gardner,4,a month ago,"For the price, I would probably go somewhere else.  Everything was good -- and the chicken main course and egg appetizer were great -- but you can get much better food in Paris for less money."
24,"https://www.google.com/maps/place/La+Tour+d'Argent/@48.8497901,2.3527581,17z/data=!3m1!4b1!4m5!3m4!1s0x47e671e4b41c8a83:0x5bd4a63441a1398a!8m2!3d48.8498104!4d2.3548718?authuser=0&hl=en",Dale Meister,5,a month ago,"A great place for dinner while La Tour d'Argent is being renovated.  Nice casual atmosphere, great service, food very well prepared and a nice wine list."
25,"https://www.google.com/maps/place/La+Tour+d'Argent/@48.8497901,2.3527581,17z/data=!3m1!4b1!4m5!3m4!1s0x47e671e4b41c8a83:0x5bd4a63441a1398a!8m2!3d48.8498104!4d2.3548718?authuser=0&hl=en",Sondra,2,a month ago,Disappointed in the food & the staff. Limited menu. Steak very tough. Slow service. Had looked forward to this visit again.
26,"https://www.google.com/maps/place/La+Tour+d'Argent/@48.8497901,2.3527581,17z/data=!3m1!4b1!4m5!3m4!1s0x47e671e4b41c8a83:0x5bd4a63441a1398a!8m2!3d48.8498104!4d2.3548718?authuser=0&hl=en",Anne-Laure Le Cunff,5,3 years ago,"We had an exceptional experience at the Tour d'Argent one Saturday evening. The view was perfect — we were seated by the window — and everything we ordered was delicious. They have one of the most impressive wine cellars in the world. The wine list was literally the size of an encyclopaedia. The sommelier knew it by heart and recommended the perfect pairings, which were not necessarily the most expensive bottles on the list. Tour d'Argent is obviously very, very pricey, but it's a once in a lifetime experience, best shared with amazing company to complement the setting, the service and the food."
27,"https://www.google.com/maps/place/La+Tour+d'Argent/@48.8497901,2.3527581,17z/data=!3m1!4b1!4m5!3m4!1s0x47e671e4b41c8a83:0x5bd4a63441a1398a!8m2!3d48.8498104!4d2.3548718?authuser=0&hl=en",peter picataggio,5,4 years ago,Wine wine wine wine. We went there twice during our trip. The food is spectacular but you are here for one of the best wine lists the world has seen. Be patient and search carefully as you will find stunners and that you will talk about the rest of your life. The staff and service are spectacular though I think they were taken back by the amount of wine we purchased . We drank every last drop! I am betting they thought we were gonna leave a bunch..
28,"https://www.google.com/maps/place/La+Tour+d'Argent/@48.8497901,2.3527581,17z/data=!3m1!4b1!4m5!3m4!1s0x47e671e4b41c8a83:0x5bd4a63441a1398a!8m2!3d48.8498104!4d2.3548718?authuser=0&hl=en",Paul Carbone,3,a month ago,"Disappointing experience all around. The maître de was unwelcoming and seemed irritated by our request to move tables even though the restaurant was practically empty.  Our waiter was inattentive, slow and had a major attitude. Our wine came after our meals and we had to remind him multiple times. The food was fine but nothing very special. Chicken was dry. We noted in the reservation this was to celebrate my mom's 80th birthday and they made no mention of it. Don't waste a meal here - there are too many other great places in Paris to try."
29,"https://www.google.com/maps/place/La+Tour+d'Argent/@48.8497901,2.3527581,17z/data=!3m1!4b1!4m5!3m4!1s0x47e671e4b41c8a83:0x5bd4a63441a1398a!8m2!3d48.8498104!4d2.3548718?authuser=0&hl=en",M. Gabriel,5,3 years ago,"To be or not to be emotional ... Probably one of the most well known Restaurant in the world : La Tour d'Argent. I have been leaving in Paris since years and never had to real opportunity to go in this restaurant.   My first experience was just exceptional and emotional. First the location is simply outstanding downtown Paris with a view of Notre Dame (At the time I am posting the comments the drama of Notre Dame has happened). The river ""la Seine"" . The  charming interior is great and there is a diamond down the building : the cellar is just crazy - an outstanding experience when you take the time to visit and get the all story . Then the service and the dinner were simply all great from the beginning until the end. I did not have the opportunity to try the specialty ""Canard au sang"" but I will definitively remember this experience. Thank you Chef Philippe Labbé."
30,"https://www.google.com/maps/place/La+Tour+d'Argent/@48.8497901,2.3527581,17z/data=!3m1!4b1!4m5!3m4!1s0x47e671e4b41c8a83:0x5bd4a63441a1398a!8m2!3d48.8498104!4d2.3548718?authuser=0&hl=en",Stefan Luders,2,5 months ago,"Valentine's menu was preprepared and mediocre. No actual cooking involved, just heating things up.

Aggressively tries to sell their own overpriced Champagne.

Two glasses of a young Sauterne cost 20,- each, no warning given.

Maybe it's better during a normal weekday, but for the money we ended up spending there are plenty of nicer places than this in Paris.

All in all, militantly commercial with little to back it up"
31,"https://www.google.com/maps/place/La+Tour+d'Argent/@48.8497901,2.3527581,17z/data=!3m1!4b1!4m5!3m4!1s0x47e671e4b41c8a83:0x5bd4a63441a1398a!8m2!3d48.8498104!4d2.3548718?authuser=0&hl=en",Jeff DeLeone,5,7 months ago,"La Tour d'Argent is one of the finest restaurants in the world.  The decor, ambience and views are spectacular.  The food, wine and service is second to no other restaurant.  It is a restaurant that everyone must experience at least once (or more) in his/her lifetime!"
32,"https://www.google.com/maps/place/La+Tour+d'Argent/@48.8497901,2.3527581,17z/data=!3m1!4b1!4m5!3m4!1s0x47e671e4b41c8a83:0x5bd4a63441a1398a!8m2!3d48.8498104!4d2.3548718?authuser=0&hl=en",Sophie Verhoeven,5,a year ago,Amazing experience. Beautiful terrace and splendid food.
33,"https://www.google.com/maps/place/La+Tour+d'Argent/@48.8497901,2.3527581,17z/data=!3m1!4b1!4m5!3m4!1s0x47e671e4b41c8a83:0x5bd4a63441a1398a!8m2!3d48.8498104!4d2.3548718?authuser=0&hl=en",Sophie Catelain,5,6 months ago,"An incredible venue as well as deluxe gourmet experience. We had the ""Tour d'argent"" menu which combines the best of the Maison : caviar, foie gras, duck, Saint Pierre... as delicate for the palate as it is to look at, a real
beautiful presentation. The 180 degrees view on the Seine is just magical... Will definitely return."
34,"https://www.google.com/maps/place/La+Tour+d'Argent/@48.8497901,2.3527581,17z/data=!3m1!4b1!4m5!3m4!1s0x47e671e4b41c8a83:0x5bd4a63441a1398a!8m2!3d48.8498104!4d2.3548718?authuser=0&hl=en",Sari Rustiani,5,3 years ago,Fantastic french bistro with 5 stars classic french fare. Had a whole duck served as two courses which was spectacular. Best to get there with an empty stomach. Highly recommended
35,"https://www.google.com/maps/place/La+Tour+d'Argent/@48.8497901,2.3527581,17z/data=!3m1!4b1!4m5!3m4!1s0x47e671e4b41c8a83:0x5bd4a63441a1398a!8m2!3d48.8498104!4d2.3548718?authuser=0&hl=en",J S,5,4 years ago,If you have a chance I strongly recommend to go to this restaurant. They serve traditional duck dish. If you order duck you will get certification card which numbering they served duck. And my favorite one their dish is crape. As I know thief crape is best in the world.
36,"https://www.google.com/maps/place/La+Tour+d'Argent/@48.8497901,2.3527581,17z/data=!3m1!4b1!4m5!3m4!1s0x47e671e4b41c8a83:0x5bd4a63441a1398a!8m2!3d48.8498104!4d2.3548718?authuser=0&hl=en",Chad,5,5 years ago,"Great food, excellent service. We didn't speak the language and brought kids. Everything was perfect."
