id,input_url,user_name,score,published_at,text
274,"https://www.google.com/maps/place/La+Tour+d'Argent/@48.8497901,2.3527581,17z/data=!3m1!4b1!4m5!3m4!1s0x47e671e4b41c8a83:0x5bd4a63441a1398a!8m2!3d48.8498104!4d2.3548718?authuser=0&hl=en",A Coll,1,2 days ago,"Absolutely one of the worst dining experiences I’ve had in Paris for the price. The staff were non-existent and when present, hopeless. No water offered, waited 20 minutes upon sitting down to be offered anything.  The ceasar salad (€36) was inedible. See photos. Drenched in a dressing, brown and sad salad leaves, the shrimp was raw in some parts and not cleaned in others with the shrimp intestinal track still there. Disgusting and a rip off. After telling one of the wait staff I had finished with my beer I watched it sit on my table for an hour. Just no interest, care and terrible quality service all round. The mains were very badly cooked. Kidney was swimming in a sickeningly sweet mustard sauce and the chicken was over cooked and potatoes drenched in oil. For over €200 for 2 people just for food, this was absolutely terrible. Don’t waste your time."
275,"https://www.google.com/maps/place/La+Tour+d'Argent/@48.8497901,2.3527581,17z/data=!3m1!4b1!4m5!3m4!1s0x47e671e4b41c8a83:0x5bd4a63441a1398a!8m2!3d48.8498104!4d2.3548718?authuser=0&hl=en",George Cho,4,3 months ago,"(Translated by Google) The view is nice and the food is delicious.

(Original)
뷰가 좋고 음식이 맛있습니다."
276,"https://www.google.com/maps/place/La+Tour+d'Argent/@48.8497901,2.3527581,17z/data=!3m1!4b1!4m5!3m4!1s0x47e671e4b41c8a83:0x5bd4a63441a1398a!8m2!3d48.8498104!4d2.3548718?authuser=0&hl=en",Simone Barbangelo,5,6 months ago,"(Translated by Google) One of the best and most delicious restaurants I've eaten in Paris. Delicious dishes of the highest quality. Very friendly and professional staff.
Congratulations!

(Original)
Uno dei ristoranti più buoni e deliziosi in cui abbia mangiato a Parigi. Pietanze prelibate e di altissima qualità. Personale molto cordiale e professionale.
Complimenti!"
277,"https://www.google.com/maps/place/La+Tour+d'Argent/@48.8497901,2.3527581,17z/data=!3m1!4b1!4m5!3m4!1s0x47e671e4b41c8a83:0x5bd4a63441a1398a!8m2!3d48.8498104!4d2.3548718?authuser=0&hl=en",Flavien Vaneson,5,3 months ago,"(Translated by Google) The setting is nice, in the spirit of a traditional brasserie with gingham tablecloths at the table. As an aperitif, we are served homemade pork rillettes. It's very very good.

Special mention for the world champion egg mayo (9€)! The cooking of the egg is perfect, the well-seasoned mayonnaise holds together perfectly. The egg is placed on a potato base which adds extra texture to the starter.

The dishes are generous, appetizing and scoundrels, all at a fair price. The sausage from Conquet (21€) won us over. We also taste the young pigeon (42€), a great first. It's a nice discovery, where the muscovado softens the meat and makes the link with the carrots.

To accompany the meal, a good well-cooked tradition and a fruit bread that comes from @leboulangerdelatour. Really next door.

We all opted for the dessert of the day, the vanilla & peanut millefeuille (€10)! Well garnished with a pretty pastry cream, the dough is crispy, the peanut-caramel mixture recalls the taste of darlings. Regressive.

A nice Sunday meal in a warm traditional brasserie, with quality dishes and a sober and efficient service.

(Original)
Le cadre est sympa, dans un esprit de brasserie tradi avec des nappes en vichy à table. En apéritif, on nous sert des rillettes de porc maison. C’est très très bon.

Mention spéciale pour l'œuf mayo champion du monde (9€) ! La cuisson de l'œuf est nickel, la mayonnaise bien assaisonnée se tient parfaitement. L'œuf est posé sur un socle de pomme de terre qui ajoute une texture supplémentaire à l’entrée.

Les plats sont généreux, appétissants et canailles, le tout à un prix correct. La saucisse de chez Conquet (21€) nous a conquis. On goûte aussi le pigeonneau (42€), une grande première. C’est une jolie découverte, où le muscovado adoucit la viande et fait le lien avec les carottes.

Pour accompagner le repas, une bonne tradition bien cuite et un pain aux fruits qui viennent de chez @leboulangerdelatour. Vraiment la porte à côté.

On a tous opté pour le dessert du jour, le millefeuille vanille & cacahuètes (10€) ! Bien garni d’une jolie crème pâtissière, la pâte est croustillante, le mélange cacahuète-caramel rappelle le goût des chouchous. Régressif.

Un joli repas du dimanche dans une brasserie traditionnelle chaleureuse, avec des plats de qualité et un service sobre et efficace."
278,"https://www.google.com/maps/place/La+Tour+d'Argent/@48.8497901,2.3527581,17z/data=!3m1!4b1!4m5!3m4!1s0x47e671e4b41c8a83:0x5bd4a63441a1398a!8m2!3d48.8498104!4d2.3548718?authuser=0&hl=en",laurent cramoisy,5,6 months ago,"(Translated by Google) I could have put 10 🌟 everything is so perfect. From the welcome to the coffee ☕, it's simply magical. A fabulous meal (yet the 1st menu), impeccable service and flawless, the friendliness of the staff. My taste buds are still quivering

(Original)
J'aurais pu mettre 10 🌟 tellement tout est parfait.  De l'accueil jusqu'au café ☕,  c'est simplement magique. Un repas fabuleux (pourtant le 1er menu), un service impeccable et sans fausse note, la gentillesse du personnel. Mes papilles frissonnent encore"
279,"https://www.google.com/maps/place/La+Tour+d'Argent/@48.8497901,2.3527581,17z/data=!3m1!4b1!4m5!3m4!1s0x47e671e4b41c8a83:0x5bd4a63441a1398a!8m2!3d48.8498104!4d2.3548718?authuser=0&hl=en",Pab Lo,1,7 months ago,"(Translated by Google) The desserts are very good. The starters and main courses are average. I had a bad experience ordering the game of the day, it was hard to cut and not good. I found 5 pellets there (see right of photo), that may prove he was wild but too many pellets for my liking. The service was the most disappointing, at the end of the service when I noted that the game was hard to cut, I was told that it was normal because it was wild, of course the game is harder and stronger in taste. but this was the worst I have eaten. My final answer was ""so next time take the duck""

(Original)
Les desserts sont très bons. Les entrées et plats sont moyens. J’ai eu une mauvaise expérience en commandant le gibier du jour, il était dur à couper et pas bon. J’y ai trouvé 5 plombs (cf. à droite de la photo), cela peut prouver qu’il était sauvage mais trop de plombs à mon goût. Le service a été le plus décevant, à la fin du service lorsque j’ai fait noter que le gibier était dur à coupé on me répond que c’est normal car il était sauvage, certes le gibier est plus dur et plus fort en goût mais celui-ci a été le pire que j’ai mangé. Ce que j’ai eu comme réponse finale a été  « alors la prochaine fois prenez le canard »"
280,"https://www.google.com/maps/place/La+Tour+d'Argent/@48.8497901,2.3527581,17z/data=!3m1!4b1!4m5!3m4!1s0x47e671e4b41c8a83:0x5bd4a63441a1398a!8m2!3d48.8498104!4d2.3548718?authuser=0&hl=en",Séverine T,5,7 months ago,"(Translated by Google) Thank you to the entire Tour d'Argent team! We had a great time for our parents' 40th wedding anniversary. We had the lunch menu and were really not disappointed. It was plentiful and delicious. We will not hesitate to come back to this Parisian institution!

(Original)
Merci à toute l'équipe de la Tour d'Argent ! Nous avons passé un très bon moment pour les 40 ans de mariage de nos parents. Nous avons pris le menu déjeuner et nous n'avons vraiment pas été déçus. C'était copieux et délicieux. Nous n'hésiterons pas à revenir dans cette institution parisienne !"
281,"https://www.google.com/maps/place/La+Tour+d'Argent/@48.8497901,2.3527581,17z/data=!3m1!4b1!4m5!3m4!1s0x47e671e4b41c8a83:0x5bd4a63441a1398a!8m2!3d48.8498104!4d2.3548718?authuser=0&hl=en",Emilie Saint-Genis,5,4 months ago,"(Translated by Google) Impeccable welcome and service. The dishes are extremely tasty. And what a view 🥰 The establishment will soon be closed for work for 9 months.

(Original)
Accueil et service irréprochables. Les plats sont extrêmement savoureux. Et quelle vue 🥰 L’établissement sera prochainement fermé pour travaux pendant 9 mois."
282,"https://www.google.com/maps/place/La+Tour+d'Argent/@48.8497901,2.3527581,17z/data=!3m1!4b1!4m5!3m4!1s0x47e671e4b41c8a83:0x5bd4a63441a1398a!8m2!3d48.8498104!4d2.3548718?authuser=0&hl=en",iza 68,5,8 months ago,"(Translated by Google) Very good table, very nice discovery
we enjoyed fine dining, successful meal from start to finish. Nice offer of wines by the glass. Rather high price for a 1 * restaurant

(Original)
Très bonne table, très belle découverte
nous avons apprécié une cuisine raffinée , repas réussi du début à la fin. Belle proposition de vins au verre. Tarif plutôt élevé pour un restaurant 1*"
283,"https://www.google.com/maps/place/La+Tour+d'Argent/@48.8497901,2.3527581,17z/data=!3m1!4b1!4m5!3m4!1s0x47e671e4b41c8a83:0x5bd4a63441a1398a!8m2!3d48.8498104!4d2.3548718?authuser=0&hl=en",Thomas W.J.,4,6 months ago,"(Translated by Google) It is the little brother of the Tour D'Argent, which I have visited 3 times, in 1988 when it had 3 Michelin stars and 2 times when it only had 1 star. The last one exactly 3 years ago.
Well, the same thing happens to him as his older brother: there is a disproportion between quality and price
The quality of their products is indisputable. but they pass
A mini glass of champagne, €15, is disproportionate. The Foie is delicious but it is not worth €20 for the piece they give you.
The meat was delicious, with a very tasty pepper sauce, €39.
In short, everything is very tasty, but a little too expensive.
The bathroom, unique, very clean.

(Original)
Es el hermano pequeño de la Tour D’Argent, el cual he visitado en 3 ocasiones, en 1988 cuando tenía 3 estrellas Michelin y 2 veces cuando solo tenia 1 estrella. La última hace exactamente 3 años.
Pues bien, le pasa lo mismo que a su hermano mayor: hay una desproporción entre calidad y precio
La calidad de sus productos es indiscutible. Pero se pasan
Una minicopa de champagne, 15€, es desproporcionado. El Foie está riquísimo pero no vale 20€ el trozo que te ponen.
La carne estaba deliciosa, con una salsa de pimienta sabrosisima, 39€.
En fin, muy rico todo, pero un poco demasiado caro.
El baño, único, muy limpio."
284,"https://www.google.com/maps/place/La+Tour+d'Argent/@48.8497901,2.3527581,17z/data=!3m1!4b1!4m5!3m4!1s0x47e671e4b41c8a83:0x5bd4a63441a1398a!8m2!3d48.8498104!4d2.3548718?authuser=0&hl=en",Brigitte BD,5,5 months ago,"(Translated by Google) Invitation by our son as a Christmas present (he loves us very much)
Excellent from start to finish.
We are looking forward to next year (Christmas 2023)

(Original)
Invitation par notre fils en cadeau de noël (il nous aime beaucoup)
Excellent du début à la fiiiiinnnnn.
Nous attendons l'année prochaine (noel2023) avec impatience"
285,"https://www.google.com/maps/place/La+Tour+d'Argent/@48.8497901,2.3527581,17z/data=!3m1!4b1!4m5!3m4!1s0x47e671e4b41c8a83:0x5bd4a63441a1398a!8m2!3d48.8498104!4d2.3548718?authuser=0&hl=en",Catherine P,5,8 months ago,"(Translated by Google) If you want a memorable candlelight dinner, you've come to the right place. The place and the panoramic view are magnificent. You can therefore admire the Seine and the outskirts of Paris while tasting very refined dishes of French gastronomy. You can completely trust their wide selection of wines.

(Original)
Si vous désirez un dîner au chandelle mémorable, vous etes au bon endroit. Le lieu et la vue panoramique sont magnifiques. Vous pourrez donc admirer la Seine et les abords de Paris tout en dégustant des plats très raffinés de la gastronomie française. Vous pouvez faire entièrement confiance a leur large sélection de vins"
286,"https://www.google.com/maps/place/La+Tour+d'Argent/@48.8497901,2.3527581,17z/data=!3m1!4b1!4m5!3m4!1s0x47e671e4b41c8a83:0x5bd4a63441a1398a!8m2!3d48.8498104!4d2.3548718?authuser=0&hl=en",Thomas Louzani (Hlzni),5,3 months ago,"(Translated by Google) 10 stars 🌟 ideal setting, very nice place. Personal attentive, fast, professional. And cute ! 20/20 service. Meal 20/20 Table wine 20/20 Aperitif 20/20 Bravo! And thank you for our taste buds and there good treatment! Nothing to say we will be back!

(Original)
10 étoiles 🌟 cadre idéal, endroit très sympas. Personnels à l’écoute, rapide, pro. Et mignon ! Service 20/20. Repas 20/20 Vin de table 20/20 Apéro 20/20 Bravo ! Et merci pour nos papilles et là bien traitance ! Rien à dire nous reviendrons !"
287,"https://www.google.com/maps/place/La+Tour+d'Argent/@48.8497901,2.3527581,17z/data=!3m1!4b1!4m5!3m4!1s0x47e671e4b41c8a83:0x5bd4a63441a1398a!8m2!3d48.8498104!4d2.3548718?authuser=0&hl=en",S. Arconada,4,a month ago,"(Translated by Google) After a first great experience this fall, I came back for lunch at the Rôtisserie d'Argent this summer. We took a table on the deck outside, enjoying a magnificent view of the river and the Ile de la Cité.
I tested the Caesar salad and my friend the kidneys. Although accompanied by a good wine and tasty bread, I must admit that we were quite disappointed by these dishes. The salad cut into too small pieces for my taste, the chicken tender but lacking in flavor, just like the kidneys.
Passionate about pastry and chocolate, I of course chose the grand cru chocolate tart for dessert but again, the texture and taste did not convince me. The strawberry clafoutis, on the other hand, was excellent.
The fact remains that the service, always impeccable, the decor and the quality of the products made this moment very pleasant.

(Original)
Après une première belle expérience cet automne, je suis revenue déjeuner à la Rôtisserie d'Argent cet été. Nous avons pris une table sur le pont dehors, profitant ainsi d'une vue magnifique sur le fleuve et l'île de la Cité.
J'ai testé la salade César et mon ami les rognons. Bien qu'accompagnés d'un bon vin et de pain goûteux, je dois avouer que nous avons été assez déçus par ces plats. La salade coupée en trop petits morceaux à mon goût, le poulet tendre mais manquant de saveur, tout comme les rognons.
Passionnée de pâtisserie et de chocolat, j'ai bien entendu choisi la tarte au chocolat grand cru en dessert mais là encore, la texture et le goût ne m'ont pas convaincue. Le clafoutis aux fraises était en revanche excellent.
Il n'en reste pas moins que le service, toujours impeccable, le décor et la qualité des produits ont rendu ce moment très agréable."
288,"https://www.google.com/maps/place/La+Tour+d'Argent/@48.8497901,2.3527581,17z/data=!3m1!4b1!4m5!3m4!1s0x47e671e4b41c8a83:0x5bd4a63441a1398a!8m2!3d48.8498104!4d2.3548718?authuser=0&hl=en",Mengxue Xia,4,7 months ago,"(Translated by Google) Very good value for money, decent service time and very easy to book as well, staff and lovely and we had great food on New Years Eve

(Original)
Très bon rapport qualité prix, temps de service convenable et très facile de réserver également, le personnel et charmant et nous avons très bien manger ce soir du réveillon"
289,"https://www.google.com/maps/place/La+Tour+d'Argent/@48.8497901,2.3527581,17z/data=!3m1!4b1!4m5!3m4!1s0x47e671e4b41c8a83:0x5bd4a63441a1398a!8m2!3d48.8498104!4d2.3548718?authuser=0&hl=en",Thomas RENOUX,5,a month ago,"(Translated by Google) Magical moment.
The setting, the view, the character of the establishment.
A treat for the taste buds. Everything was beautiful and delicious, delicate flavors, the show if you take the famous duck with blood! A wine bible and a very professional and very friendly sommelier (we were allowed to visit the cellar...).

(Original)
Moment magique.
Le cadre, la vue, le cachet de l'établissement.
Un régal des papilles. Tout était beau et délicieux, des saveurs délicates, le spectacle si vous prenez le fameux canard au sang !  Une bible des vins et un sommelier très professionnel et fort sympathique ( nous avons eu le droit à la visite de la cave ...)."
290,"https://www.google.com/maps/place/La+Tour+d'Argent/@48.8497901,2.3527581,17z/data=!3m1!4b1!4m5!3m4!1s0x47e671e4b41c8a83:0x5bd4a63441a1398a!8m2!3d48.8498104!4d2.3548718?authuser=0&hl=en",Marie Barbier-Mueller,5,a year ago,"(Translated by Google) When you walk into this legendary Parisian restaurant, which they say has existed since 1582, you immerse yourself in a wonderful world! The historic setting, the magnificent view, the excellent service, the famous duck au sang (and many other delicious dishes) ... so many elements that made our evening unforgettable!

(Original)
Lorsque l’on rentre dans ce restaurant parisien mythique, dont il se dit qu’il existe depuis 1582, on s’immerge dans un monde merveilleux! Le cadre historique, la magnifique vue, l’excellent service, le fameux canard au sang (et de nombreux autres délicieux mets)…autant d’éléments qui ont rendu notre soirée inoubliable!"
291,"https://www.google.com/maps/place/La+Tour+d'Argent/@48.8497901,2.3527581,17z/data=!3m1!4b1!4m5!3m4!1s0x47e671e4b41c8a83:0x5bd4a63441a1398a!8m2!3d48.8498104!4d2.3548718?authuser=0&hl=en",Norris Lam,5,11 months ago,"(Translated by Google) I had a great time in this restaurant, very welcoming service, pleasant atmosphere, quality foods. I absolutely recommend you

(Original)
J’ai passé un très bon moment dans ce resto, un service très accueillant, l’ambiance agréable, les nourritures qualitatives. Je vous recommande absolument"
292,"https://www.google.com/maps/place/La+Tour+d'Argent/@48.8497901,2.3527581,17z/data=!3m1!4b1!4m5!3m4!1s0x47e671e4b41c8a83:0x5bd4a63441a1398a!8m2!3d48.8498104!4d2.3548718?authuser=0&hl=en",ML T,5,5 months ago,"(Translated by Google) Magical moment for my son's 20th birthday. The setting and the view first, hoping that the renovations to come will retain the character of the establishment. Then, the delight of the taste buds. We had taken the menu around lunch but that we modulated by taking two starters and a main course for some, one starter and two main courses for others. Everything was beautiful and delicious, delicate flavors, we loved the emulsions that accompany the dishes. A wine list, what am I saying... A cellar book like we've never seen before in terms of choice, so we also operate according to our budget... The sommelier is very professional and very friendly. In short, we recommend to celebrate the great events of life.

(Original)
Moment magique pour les 20 ans de mon fils. Le cadre et la vue  d abord, en espérant que les travaux de rénovation à venir conserveront le cachet de l établissement. Ensuite, le régal des papilles. Nous avions pris le menu autour du déjeuner mais que nous avons modulé en prenant deux entrées et un plat  pour les uns, une entrée et deux plats pour les autres. Tout était beau et délicieux, des saveurs délicates, on a adoré les émulsions qui accompagnent les plats. Une carte des vins, que dis je... Un livre de cave comme on en a jamais vu avant au niveau du choix que du coup, on opère aussi en fonction de notre budget... Le sommelier est très professionnel et fort sympathique. Bref, nous recommandons pour fêter les grands événements de la vie."
293,"https://www.google.com/maps/place/La+Tour+d'Argent/@48.8497901,2.3527581,17z/data=!3m1!4b1!4m5!3m4!1s0x47e671e4b41c8a83:0x5bd4a63441a1398a!8m2!3d48.8498104!4d2.3548718?authuser=0&hl=en",PEGGY B.,5,7 months ago,"(Translated by Google) Invited by my boss, for a seminar in Paris ⚜️
A meal in the tradition of great French tables.
Unique and very enjoyable experience 😍🌹

(Original)
Invitée par mon patron, en séminaire à Paris ⚜️
Un repas dans la tradition des grandes tables françaises.
Expérience inédite et très enjoyable 😍🌹"
294,"https://www.google.com/maps/place/La+Tour+d'Argent/@48.8497901,2.3527581,17z/data=!3m1!4b1!4m5!3m4!1s0x47e671e4b41c8a83:0x5bd4a63441a1398a!8m2!3d48.8498104!4d2.3548718?authuser=0&hl=en",Julie Manizan,5,2 months ago,"(Translated by Google) Brasserie adjoining the famous starred restaurant. Winner of the 2022 mayonnaise egg contest, I had to come and taste it! And not disappointed! Very good meal with friends, fair and controlled cooking, exceptional meat on the spit and a fine selection of wine.

(Original)
Brasserie attenante au célèbre etoilé. Gagnant du Concours de l’œuf mayonnaise 2022, je me devais de venir goûter! Et pas déçue! Très bon repas entre amis, cuisson juste et maîtrisé, viande équipe la broche exceptionnelle et belle sélection de vin."
295,"https://www.google.com/maps/place/La+Tour+d'Argent/@48.8497901,2.3527581,17z/data=!3m1!4b1!4m5!3m4!1s0x47e671e4b41c8a83:0x5bd4a63441a1398a!8m2!3d48.8498104!4d2.3548718?authuser=0&hl=en",Guillaume Bellet,5,5 months ago,"(Translated by Google) Little sister of the gastronomic restaurant, this table is worth the detour. A menu of gourmet and quality bistro dishes. Beautiful plates and a few bottles that make for a good time. Special mention to the room team for their smile and sympathy. It must be said that our table last night was a bit noisy / joyful because we had a very good time there.

(Original)
Petite sœur du restaurant gastronomique cette table vaut le détour. Une carte de plats bistrots gourmands et de qualité. De belles assiettes et quelques flacons qui font passer un bon moment. Mention particulière à l’équipe de salle pour son sourire et sa sympathie. Il faut dire que notre table d’hier soir était un peu bruyante / joyeuse car nous y avons passé un très bon moment."
296,"https://www.google.com/maps/place/La+Tour+d'Argent/@48.8497901,2.3527581,17z/data=!3m1!4b1!4m5!3m4!1s0x47e671e4b41c8a83:0x5bd4a63441a1398a!8m2!3d48.8498104!4d2.3548718?authuser=0&hl=en",Nina Duhain,1,a month ago,"(Translated by Google) Very bad experience. We arrived 15 minutes late having warned on the phone. We had to be installed on the terrace and were forced to be inside while there was room outside. The manager gave me the card in a very rude way and told me that I had to order immediately and quickly when I didn't even have time to take a look. I was forced to leave in view of this terrible reception. My friend is a restaurateur, we know the job and it's a shame not to like his job or the people we welcome.

(Original)
Très mauvaise expérience. Nous sommes arrivés avec 15 minutes de retard en ayant prévenu au téléphone. Nous devions être installé en terrasse et avons été forcé à être à l’intérieur alors qu’il restait de la place à l’extérieur. Le responsable m’a donné la carte de manière très désagréable et m’a dit que je devais commandé immédiatement et vite alors que je n’ai même pas eu le temps d’y jeter un coup d’œil. J’ai été forcé de partir au vu de cet accueil affreux. Mon ami est restaurateur, nous connaissons le métier et il est dommage de n’aimer ni son métier ni les gens qu’on accueille."
297,"https://www.google.com/maps/place/La+Tour+d'Argent/@48.8497901,2.3527581,17z/data=!3m1!4b1!4m5!3m4!1s0x47e671e4b41c8a83:0x5bd4a63441a1398a!8m2!3d48.8498104!4d2.3548718?authuser=0&hl=en",Erolfflorence Cabrolier,4,3 months ago,"(Translated by Google) A place of great conviviality, exquisite staff. A beautiful French brasserie setting. On the plate, excellent, well-crafted products and a rich wine list. And then the Seine, history, etc…

(Original)
Un lieu de grande convivialité, un personnel exquis. Un cadre de belle brasserie française. Dans l’assiette d’excellents produits bien travaillés et une carte de vins riche. Et puis la Seine, l’histoire, etc…"
298,"https://www.google.com/maps/place/La+Tour+d'Argent/@48.8497901,2.3527581,17z/data=!3m1!4b1!4m5!3m4!1s0x47e671e4b41c8a83:0x5bd4a63441a1398a!8m2!3d48.8498104!4d2.3548718?authuser=0&hl=en",Khanh Truong,2,4 weeks ago,"(Translated by Google) The service was very slow, the young waiters seemed to be amateurs and nonchalant. Correct meal but nothing more. On the other hand, the team leader on the terrace was very efficient and professional.

(Original)
Le service était très lent, les jeunes serveurs semblaient être des amateurs et nonchalant. Repas correct mais sans plus. Par contre le chef d’équipe à la terrasse était très efficace et professionnel."
299,"https://www.google.com/maps/place/La+Tour+d'Argent/@48.8497901,2.3527581,17z/data=!3m1!4b1!4m5!3m4!1s0x47e671e4b41c8a83:0x5bd4a63441a1398a!8m2!3d48.8498104!4d2.3548718?authuser=0&hl=en",Leona,5,7 months ago,"(Translated by Google) Great restaurant with a lot of history. We went to lunch everything was super

(Original)
Отличный ресторан, с большой историей. Ходили на обед все было супер"
